"ART_ID","TAB_NAME","TITLE","ARTIST","ADDRESS","SHORT_DESC","DESC1","DESC2","DESC3","WEBSITE","longitude","latitude","location","City_Quadrants","Ward_Boundaries","Calgary_Communities"
"P2004.001.001","Southwest","Skywalk","Derek Besant","Canyon Meadows pedestrian overpass (North of Canyon Meadows Drive)","An image of a Chinook sky greets vehicles traveling along Macleod Trail South, while pedestrians using the overpass are invited to take a walk through the clouds.","This 14 panel frieze represents one of Calgary's most familiar weather conditions, the Chinook, a strong wind system which blows warmer air into the local environment, causing rapid temperature shifts and changing cloud formations.","""On sunny days the artwork serves to blend the bridge infrastructure into its surrounding environment.  On cloudy days, it provides a reminder of sunny days to come.""","","https://www.calgary.ca/CSPS/Recreation/Documents/Public-art/Percent-for-Public-Art-Skywalk.pdf?noredirect=1","-114.068763619515","50.9364970489145","""(50.936497048915, -114.068763619515)""","3","5","283"
"P2004.002.001","Northwest","The Language of Life","James Holroyd","Thornhill Aquatic and Recreation Centre (6715 Centre St. N.W.)","Four large black and white photographs mounted by the entryway of this facility feature athletes suspended in motion.","Known for exploring art through non-digital photography, the artist was able to use multiple exposures (the act of exposing the same section of film repeatedly to light) to create these fascinating images which represent activities occurring at this Centre.","""Highlighting the movement of an athlete's body while in motion, the sports of Tai chi, hockey, swimming and weight training have been captured as if frozen in time.""","","https://www.calgary.ca/CSPS/Recreation/Documents/Public-art/Percent-for-Public-Art-Language-of-Life.pdf","-114.065183764311","51.1128700530453","""(51.112870053045, -114.065183764311)""","2","2","261"
"P2004.003.001","Southwest","An Auspicious Find","Lori Sobkowich","Prince's Island Park pathway (698 Eau Claire Ave. S.W.)","15,000 marbles create images which reference the ecological environment a visitor might experience when visiting Prince's Island Park.","Four pixilated images represent the flora and fauna of the area in a spontaneous and unique fashion. The marbles shimmer and shift in colour depending on the time of day, while the images become abstracted the closer the viewer stands to the sculptures themselves. Look closely. Can you see yourself?","","","https://www.calgary.ca/CSPS/Recreation/Documents/Public-art/Percent-for-Public-Art-Auspicious-Find.pdf","-114.06938337687","51.0554655243289","""(51.055465524329, -114.06938337687)""","1","7","295"
"P2005.001.001 A-E","Southwest","From the Clouds to the Water","George Duncan","Killarney Dry Pond (N.W. corner of 28th Avenue and 30th Street S.W.)","A collection of forged and wrought iron railing panels and benches make up this multi-piece public art installation.","Natural materials are combined with traditional blacksmithing techniques to create these functional works of art, which contribute a sense of movement and energy to this park-like location.","""The bench design depicts cloud formations encompassed by a gently flowing framework, keeping with the organic theme of the site. The three panels in the railings have an integrated, continuous flow depicting elements of nature including the sun, rain cloud formations, stone and underground river system.""","","https://www.calgary.ca/CSPS/Recreation/Documents/Public-art/Percent-for-Public-Art-Clouds-to-Water.pdf","-114.131622105044","51.0283569222744","""(51.028356922274, -114.131622105044)""","1","14","182"
"P2005.002.001","Northeast","Celebrations","Barbara Amos","Vivo Recreation Centre (11950 Country Village Link N.E.)","This vibrant 20 piece installation reflects on and celebrates the activities which patrons of Vivo Recreation Centre may participate in on site.","Active and passive users of this facility will all see themselves reflected in these paintings which enliven the architecture of the centre's main wall. Spanning almost 90 feet, this multi-painting installation features skaters, hockey players and spectators, ensuring visitors know about the diversity of activities available throughout the complex.","""Similarly, colours and stripes which are incorporated throughout the composition were directly inspired by the markings found on the gym floors within the facility; animating the motion captured in the figures, providing a sense of spontaneity and fun.""","","https://www.calgary.ca/CSPS/Recreation/Documents/Public-art/Percent-for-Public-Art-Celebrations.pdf","-114.066539022445","51.1594115949298","""(51.15941159493, -114.066539022445)""","4","11","264"
"P2005.003.001 A-D","Northwest","Crenellated Habitat","Tony Bloom","John Laurie Blvd. N.W. pedestrian overpass into Nose Hill Park","Two sets of curved, steel panels flank either end of the """"Whispering Grasses Walkway"""", a pedestrian overpass leading into Nose Hill Park.","Images relating to the natural environment are featured on these artworks, which welcome and entice the user to explore, investigate and enjoy the natural environment around them. The curvature and patina of the panels were purposefully selected by the artist to echo the architecture of the bridge. Impressions of bison, predators and even a topographical map can be found etched into the artworks' surfaces.","","","https://www.calgary.ca/CSPS/Recreation/Documents/Public-art/Percent-for-Public-Art-Crenellated-Habitat.pdf","-114.12459656604","51.1012058240991","""(51.101205824099, -114.12459656604)""","2","7","125"
"P2007.001.001","Southwest","Jumping Trout","Violet Costello and Bob Thomasson","""Glenmore Trail, from Elbow Drive to Fifth Avenue S.W.""","Built into the retaining wall of Glenmore Trail, 144 trout are represented as if swimming and jumping along the waves in the near-by Bow River.","Rainbow trout and Brown trout are just five of the species which inhabit this nearby River, a renowned fly-fishing location. These relief forms are bolted into panels representing the water and the sky. Those jumping are highlighted by their colourful scales reflecting in the sun. Those swimming are muted from the dark water of the river.","","","https://www.calgary.ca/CSPS/Recreation/Documents/Public-art/Percent-for-Public-Art-Jumping-Trout.pdf","-114.083153755048","50.9943793432305","""(50.994379343231, -114.083153755048)""","1","8","64"
"P2007.002.001","Northwest","Strung II","Gord Ferguson","Crowchild Trail N.W. (Sarcee Trail N.W. Overpass)","Strung II is comprised of two installations; one in the piers of the underpass along Crowchild Trail N.W. and the other in the railings of the overpass along Sarcee Trail N.W.","When considering the site, the artist was drawn to barbed wire imagery feeling it would be appropriate given this location had been ranch land in the recent past. He felt the use of this imagery would help to connect the site to that history.","""From this he developed two types of experiences. The first is the large sculptural forms of barbed wire perched within the centre piers of the bridge. These are highly visible from a distance, and by C-Train and vehicular commuters who pass by on their daily commute.""","The second is the laser cut panels on the Sarcee Trail overpass, which allow for a more personal pedestrian experience. Eight panels are inset within the railing, their connection implying a continuous string of barbed wire running from one end to the other. On a sunny day they cast shadows on the bridge deck and provide an alternate viewpoint for those engaging with the site.","https://www.calgary.ca/_layouts/cocis/DirectDownload.aspx?target=http%3a%2f%2fwww.calgary.ca%2fCSPS%2fRecreation%2fDocuments%2fPublic-art%2fPercent-for-Public-Art-Strung-II.pdf&noredirect=1&sf=1","-114.178348573657","51.1106588544811","""(51.110658854481, -114.178348573657)""","2","3","245"
"P2007.003.001","Southeast","Tracking the Trail","Roger Gaudreau","Highway 22X and McKenzie Meadows Drive S.E. (under the bridge)","By the pathways of Fish Creek Park, elements of nature are combined to emphasize the uniqueness of this location where man and nature converge.","A walk through the site inspired the artist to create a multi-piece artwork, which is directly connected to this place. Whether man-made or natural in form, all of the elements from the paths to the animal tracks to the stone join together at this site.","""The adjacent paths are referenced through the linear sections of stone. Local materials such as rock and stone are embedded within, a contrast in texture to the smooth granite that surrounds it.  Animal tracks are scattered throughout, just as they were during the artist's visit and as they continue to be each day.""","Can you guess which creatures the artist discovered here on his journey?","https://www.calgary.ca/_layouts/cocis/DirectDownload.aspx?target=http%3a%2f%2fwww.calgary.ca%2fCSPS%2fRecreation%2fDocuments%2fPublic-art%2fPercent-for-Public-Art-Tracking-the-Trail.pdf&noredirect=1&sf=1","-114.008502543553","50.8941189297968","""(50.894118929797, -114.008502543553)""","3","4","5"
"P2007.004.001","Southeast","Water Garden","Linda Covitt","The City of Calgary Water Centre (625 Spiller Rd. S.E.)","A sculptural installation in the lobby of the Water Centre is a dynamic statement, utilizing water to celebrate and draw attention to the services provided within this civic building.","This multi-piece installation brings nature into an interior environment by referencing natural elements in a striking and dynamic manner. There are notions of a wooded grove as seen through the angular, tall green poles, and a natural water source, referenced by the monumental columnar tank which mimics a babbling brook, animating this site with its bubbling and fluid movements.","","","https://www.calgary.ca/CSPS/Recreation/Documents/Public-art/Percent-for-Public-Art-Water-Garden.pdf","-114.049422016727","51.0292422304783","""(51.029242230478, -114.049422016727)""","3","10","160"
"P2007.005.001","Southwest","""Bridge, Abridged""","Adam Kuby","Overpass at Glenmore Tr. and Legsby Rd. N.W.","Artwork appears throughout the sound walls, the bridge deck, the railings, and on the piers of the bridge itself, helping to tell the story of this sites development.","Inspired by the challenging requirements of this cantilevered bridge, the artist chose to reveal the complexities of engineering through his public art project.  Words and shapes help to highlight the unique design and construction of this cantilevered walkway. Basic principles of physics such as compressing, tension, and expansion are noted at critical locations throughout the site.","""To learn more about this award winning design, visit the interpretive panel sitting at the base of the overpass.""","","https://www.calgary.ca/CSPS/Recreation/Pages/Public-Art/Bridge,-Abridged---Public-Artwork.aspx","-114.112296141238","50.9990733056448","""(50.999073305645, -114.112296141238)""","1","8","122"
"P2007.006.001","Northeast","Topiary","Jim Hirschfield and Sonya Ishii","McKnight/Westwinds LRT Station (6200 36th St. N.E.)","Located in the plaza area of the LRT station, this whimsical and distinctly unique sculpture is contemporary in nature, but historical in inspiration.","Topiaries are structures grown from nature, but designed by humans. They are often fanciful, featuring large geometric shapes or figural compositions. Complicated and detailed they are commonly viewed as living sculptures. In the artist's words a """"...topiary sculpture is about cultivation and that can mean many things. It can be a cultivation of community, a cultivation of ideas or the cultivation of gardens and life.""""","""References to the Blackfoot Nation have been included through the use of circles in both this and the metal quilt installation.  The Blackfoot, one of the oldest aboriginal nations to inhabit Calgary, often incorporate circles into many of their creations, and the inclusion of this motif acts as a way to continue their connection to this site and to the community of Calgary.""","","https://www.calgary.ca/_layouts/cocis/DirectDownload.aspx?target=http%3a%2f%2fwww.calgary.ca%2fCSPS%2fRecreation%2fDocuments%2fPublic-art%2fPercent-for-Public-Art-Recollections.pdf&noredirect=1&sf=1","-113.975134743842","51.1093084137672","""(51.109308413767, -113.975134743842)""","4","9","80"
"P2007.006.001","Northeast","Columns (LRT Platform)","Jim Hirschfield and Sonya Ishii","McKnight/Westwinds LRT Station (6200 36th St. N.E.)","Located on the LRT platform, these historical images grace both sides of the supporting columns of the station roof. Viewed separately they are pieces of a story. Viewed in their entirety, the story is told.","Both sides of the columns have historical images sourced from Calgary's Glenbow Museum Archives. The images have been separated into segments, which align when the viewer stands at either end of the platform. One image is of a little girl riding a sheep and the other is of a lady standing on the back of a galloping horse.  Each image references the ranching history of this area, providing a sense of the past as the viewer journeys to their next destination.","","","https://www.calgary.ca/_layouts/cocis/DirectDownload.aspx?target=http%3a%2f%2fwww.calgary.ca%2fCSPS%2fRecreation%2fDocuments%2fPublic-art%2fPercent-for-Public-Art-Recollections.pdf&noredirect=1&sf=1","-113.975730323615","51.1091384550281","""(51.109138455028, -113.975730323615)""","4","9","80"
"P2007.006.002 A-C","Northeast","Topiary Quilts","Jim Hirschfield and Sonya Ishii","McKnight/Westwinds LRT Station (6200 36th St. N.E.)","Located near the parking entrance along the South side of the park-n-ride, these metal fence-like structures help define the boundary of this site.","Standing over seven feet in height, the images on the Quilts are directly related to the shapes and forms found in the Topiary sculpture located in the plaza area of the LRT station. They also reference the images dotted across the glass heating shelters on the station platform, continuing the playful dialogue the artists have featured throughout this site.","""References to the Blackfoot Nation have been included through the artist's use of circle motifs, an element commonly found in many Blackfoot creations. The Blackfoot are one of the oldest aboriginal nations to inhabit Calgary, and the artist's inclusion of this imagery acts as a way to continue their historical connection to this site and to the community of Calgary as a whole.""","","https://www.calgary.ca/_layouts/cocis/DirectDownload.aspx?target=http%3a%2f%2fwww.calgary.ca%2fCSPS%2fRecreation%2fDocuments%2fPublic-art%2fPercent-for-Public-Art-Recollections.pdf&noredirect=1&sf=1","-113.975715860807","51.1070475257993","""(51.107047525799, -113.975715860807)""","4","9","80"
"P2007.006.003 A-B","Northeast","Recollections (heating shelter glass)","Jim Hirschfield and Sonya Ishii","McKnight/Westwinds LRT Station (6200 36th St. N.E.)","This public artwork is one of four installations at this LRT station.","Located in the glass heating shelters on the LRT platform, these spheres of colour appear to be dots from a distance, dancing around the glass. But as viewers draw closer it is clear these dots contain photographs of people living everyday life.","""A vital component of this public art project was the inclusion of community residents in the creation of the piece. One of four installations located at the McKnight/Westwinds LRT station, Recollections invites the viewer to learn more about the community members living in the area.""","A call went out to Calgarians living in the N.E. to contribute images of their lives. From a historical photograph of Mrs. Brown with her brand new stove to an image of a resident's parents married in India in 1945, these photographs provide viewers a glimpse into significant personal, historical and community events; all of the elements that make this community a unique and special place.","https://www.calgary.ca/_layouts/cocis/DirectDownload.aspx?target=http%3a%2f%2fwww.calgary.ca%2fCSPS%2fRecreation%2fDocuments%2fPublic-art%2fPercent-for-Public-Art-Recollections.pdf&noredirect=1&sf=1","-113.975430373557","51.1094040450471","""(51.109404045047, -113.975430373557)""","4","9","80"
"P2007.007.001 A-G","Southeast","Steward","Thomas Sayre","The City of Calgary Water Centre (625 Spiller Road S.E.)","A collaborative effort between the artist and a landscape architect has transformed this garden into a functional work of art; one which draws our attention to our use and re-use of water.","Original earth cast vessels help to define this space and serve to illustrate the water harvest cycle which purposefully occurs on the Water Centre site. Representing the ancient practice of collecting and transporting water in clay pots, these vessels are directly integrated into the garden's self-sustainable irrigation system.","The man-formed river beds feed water from the building's roof throughout the landscape and past the benches designed by the artist where one may pause to reflect on the surrounding natural environment.","","https://www.calgary.ca/CSPS/Recreation/Documents/Public-art/Percent-for-Public-Art-Steward.pdf","-114.048603046373","51.0288152727708","""(51.028815272771, -114.048603046373)""","3","10","160"
"P2007.008.001","Southeast","Frozen Dreams","Blake Williams","Max Bell Arena (1001 Barlow Tr. S.E.)","Located in the entry area of the Max Bell Arena, this mural celebrates the sport of hockey.","Designed as a welcoming feature, the public artwork is intended to act as a document of the building's history, becoming a community scrapbook through the use of photographs and images provided by local teams and community members.","The result is an animated and celebratory experience which reflects the importance of hockey to this site and to Calgary.","","https://www.calgary.ca/CSPS/Recreation/Documents/Public-art/Percent-for-Public-Art-Frozen-Dreams.pdf","-114.004353906016","51.0424169510684","""(51.042416951068, -114.004353906016)""","3","12","121"
"P2008.003.001 A-AP","Northwest","The Colour of Snow","Barbara Grygutis","""Crowfoot LRT connector bridge, west side""","Conceptually and visually linked to the watercolour-like glass on the LRT station windows, the artwork in these railings is inspired by the artist's first visit to Calgary.","These 12 snowflake patterns emulate a snowstorm, drawing our attention to the unique forms that are built by nature, in an environment built by man. Pedestrians are able to enjoy the railings on a personal level, engaging with both the infrastructure and the shadows they cast as they walk by.","","","https://www.calgary.ca/CSPS/Recreation/Pages/Public-Art/The-Colour-of-Snow-Public-Artwork.aspx","-114.206982960297","51.1229249131871","""(51.122924913187, -114.206982960297)""","2","3","244"
"P2008.003.001 A-AP","Northwest","The Colour of Snow","Barbara Grygutis","Nosehill Drive overpass at Crowchild Trail N.W .","Conceptually and visually linked to the watercolour-like glass on the LRT station windows, the artwork in these railings is inspired by the artist's first visit to Calgary.","These 24 snowflake patterns emulate a snowstorm, drawing our attention to the unique forms that are built by nature, in an environment built by man. Pedestrians are able to enjoy the railings on a personal level, engaging with both the infrastructure and the shadows they cast as they walk by.","","","https://www.calgary.ca/CSPS/Recreation/Pages/Public-Art/The-Colour-of-Snow-Public-Artwork.aspx","-114.209095413734","51.1234253384395","""(51.12342533844, -114.209095413734)""","2","3","148"
"P2008.003.001 A-AP","Northwest","The Colour of Snow","Barbara Grygutis","Crowfoot LRT Station (1860 Scurfield Dr. N.W.) south glass window","Conceptually and visually linked to the railings on the nearby interchanges, the artwork in these glass windows is inspired by the artist's first visit to Calgary.","The background image of the setting sun was originally captured by the artist as she flew into Calgary for her first site visit. The dramatic colours were translated from a photograph into a watercolour-like glass composition. This was combined with snowflake images, designed to highlight their distinctive molecular structures, in the hopes of drawing the viewer's attention to the unique forms that are built by nature, in an environment built by man.","","","https://www.calgary.ca/CSPS/Recreation/Pages/Public-Art/The-Colour-of-Snow-Public-Artwork.aspx","-114.207074423425","51.1225826241342","""(51.122582624134, -114.207074423425)""","2","3","148"
"P2009.001.001 A-B","Northeast","bearing","Douglas Senft","Fire Apparatus and Repair Facility (1755 18th Ave. N.E.)","Inspired by the unseen work behind the doors of the Fire Apparatus and Repair Facility this multi piece installation is an abstracted representation of fastening and moving systems.","The personnel in this facility play a vital and supporting role to the Calgary Fire Department.  As behind the scenes work often goes uncelebrated, the artist's vision was to bring outside a larger than life representation of what occurs within the inside of this facility.","""The arch is inspired by locking and flat wave washers, modified to create an iconic arch.  Further down site is a sphere reminiscent of ball bearings which are an integral part of any moving system. Settled into the ground, these works become both a singular and united element dependent upon the viewers position.""","","https://www.calgary.ca/CSPS/Recreation/Documents/Public-art/Percent-for-Public-Art-bearing.pdf","-114.018704546227","51.0679015629987","""(51.067901562999, -114.018704546227)""","4","9","141"
"P2009.002.001","Downtown","SWARM","Stuart Keeler","6th St. S.W. LRT Station","Looking up and around, visitors to this LRT platform are surrounded by warmth and colour.","Vibrant colours meld with a swarm of leaf seeds whose chaotic patterns are not unlike those of transit commuters during rush hour; rushing and intermingling to move from here to there. These leaf seeds are also commonly referred to as keys. Can you find the other hidden keys in this installation?","","","https://www.calgary.ca/CSPS/Recreation/Documents/Public-art/Percent-for-Public-Art-SWARM.pdf","-114.074877727924","51.0467935670005","""(51.046793567001, -114.074877727924)""","1","14","262"
"P2009.004.001","Southwest","Body Mind Spirit","Blake Williams","Southland Leisure Centre (2000 Southland Dr. S.W.)","A lively mosaic greets any visitor entering the lobby of Southland Leisure Centre. Glass, text, ceramics and photography all combine to tell the story of this community focused site.","Images celebrating the activities hosted at this facility and the cultural diversity of the surrounding communities combine to highlight the importance of supporting the body, mind and spirit of the individual and the collective.","""Details small and large are all intrinsic to this artwork, as seen through the artist's use of the word """"welcome"""", translated into more than 30 languages, and incorporated this text throughout. Can you find them all?""","","https://www.calgary.ca/CSPS/Recreation/Documents/Public-art/Percent-for-Public-Art-Body-Mind-Spirit.pdf","-114.108012404767","50.9623127740886","""(50.962312774089, -114.108012404767)""","1","8","66"
"P2009.005.001 A","Northeast","Rhythms I","Karen Ho Fatt","Village Square Leisure Centre (2623 56th St. N.E.)","Two artful benches, full of whimsy, celebrate Village Square Leisure Centre and the services it provides to our community.","These functional sculptures use shapes and kinetic forms to provide a sense of movement, energy and vitality to connect the work to the theme of recreational activity. Bold colours represent the cultural vitality of the Centre, while images and motifs reflective of cultural groups are incorporated within, referencing the diversity of the community users of this facility.","""Blue waves, Buddhist wheels, figures in motion and interactive activities invite you to sit, pause and maybe even play.""","","https://www.calgary.ca/_layouts/cocis/DirectDownload.aspx?target=http%3a%2f%2fwww.calgary.ca%2fCSPS%2fRecreation%2fDocuments%2fPublic-art%2fPercent-for-Public-Art-Rhythms.pdf&noredirect=1&sf=1","-113.95456348062","51.075740027714","""(51.075740027714, -113.95456348062)""","4","9","36"
"P2009.005.001 B","Northeast","Rhythms II","Karen Ho Fatt","Village Square Leisure Centre (2623 56th St. N.E.)","Two artful benches, full of whimsy, celebrate Village Square Leisure Centre and the services it provides to our community.","These functional sculptures use shapes and kinetic forms to provide a sense of movement, energy and vitality to connect the work to the theme of recreational activity. Bold colours represent the cultural vitality of the Centre, while images and motifs reflective of cultural groups are incorporated within, referencing the diversity of the community users of this facility.","""Blue waves, Buddhist wheels, figures in motion and interactive activities invite you to sit, pause and maybe even play.""","","https://www.calgary.ca/_layouts/cocis/DirectDownload.aspx?target=http%3a%2f%2fwww.calgary.ca%2fCSPS%2fRecreation%2fDocuments%2fPublic-art%2fPercent-for-Public-Art-Rhythms.pdf&noredirect=1&sf=1","-113.954690386864","51.0756944093646","""(51.075694409365, -113.954690386864)""","4","9","36"
