"ART_ID","TAB_NAME","TITLE","ARTIST","ADDRESS","SHORT_DESC","DESC1","DESC2","DESC3","WEBSITE","longitude","latitude","location","City_Quadrants","Ward_Boundaries","Calgary_Communities"
"P2010.001.001 A-C","Northeast","Triclopse","Luke Blackstone","Multi Services Station (80th Avenue and Saddletowne Circle N.E.)","Located at the front of the building, this installation features three unified sculptures, each representing one of the emergency services housed at this location.","<i>Triclopse employs three aesthetic but functional sirens that represent the services provided by Police (copper), Fire (red) and EMS (silver) all of whom function out of this facility, working both separately and jointly as an active, unified set of protective services.</i>","""One commonality of these three organizations is their historical use of the siren as a means to alert the community. The sound of the siren is universally recognizable and is generated simply by directing a stream of air through holes that rapidly open and close. Most siren sounds today are produced electronically, but previously they were driven by electric motors or even hand-cranked.""","The three wheels in this sculpture may be rotated individually by turning the crank on the sculptures base, however, the effort needed is considerable. When two or three viewers participate by turning all of the crank-wheels at the same time, the drums can be spun easier and faster, creating a louder sound.","https://www.calgary.ca/CSPS/Recreation/Documents/Public-art/Percent-for-Public-Art-Triclopse.pdf","-113.945132474999","51.1248425003892","""(51.124842500389, -113.945132474999)""","4","11","2"
"P2010.002.001","Southeast","Guardian","Tony Stallard","Manchester Centre entrance (25 Ave. S.E.)","This steel sculpture towers over the site as if watching over or guarding this civic complex. Illuminated at night, it becomes a beacon of light marking the entry to the Manchester Centre.","The work refers to the notion of industrial units, one stacked upon the other, suggesting an inter-related dependence or a hierarchical infrastructure that relates to the current use of this civic site.","","","https://www.calgary.ca/CSPS/Recreation/Documents/Public-art/Percent-for-Public-Art-Guardian.pdf","-114.046900598334","51.0284817921071","""(51.028481792107, -114.046900598334)""","3","10","160"
"P2010.003.001","Southwest","Realidoscope","Silver Light Art Projects","Mission Cliff Bungalow Promenade (Elbow Drive and 25th Ave S.W.)","Realidoscope captures people, architecture and the natural environment found along the river pathway.","Looking through the viewfinder the reflected surroundings are accented by the ever-changing motion of nature and people around this site.","""The artist believes the use of prisms lends itself to interactive situations and community involvement, and allows the viewer to engage in the act of transition and change. That we are living in a world which is continually being rearranged and reassembled, much like the way prisms rearrange our point of view in Realidoscope.""","","","-114.071019665898","51.0295820703499","""(51.02958207035, -114.071019665898)""","1","14","297"
"P2012.001.001","Downtown","TransitStory","Jill Anholt","Centre Street LRT Platform","Enlivening the experience of the Centre Street LRT station are 30 sculptural commuters standing alongside transit users, collectively waiting for the next train to arrive.","Thousands of people wait in spontaneous collectivity on the LRT platform. In transit, they wait alone  - vaguely aware of the anonymous presence of others. Each individual shares a brief moment in time and space; a temporary moment of belonging.","""TransitStory evokes the ephemeral presence and memory of travellers. Present and absent, seen and unseen, this work seeks to capture the fleeting trace of human presence within public space.""","","https://www.calgary.ca/CSPS/Recreation/Pages/Public-Art/Downtown-Gateway-LRT-Stations.aspx","-114.061041857442","51.0463688281438","""(51.046368828144, -114.061041857442)""","3","7","262"
"P2012.002.001","Northeast","Confluence","David Dahlquist with RDG Dahlquist Art Studio","Martindale LRT Station (618 Martindale Blvd. N.E.)","Weaving together the physical and symbolic connections of people and place, these two murals were designed by the artist and the community.","A combination of LED lighting, glazed terra cotta and laser-cut steel are featured on both sides of this exterior transit station. The viewer is invited to view the symbols created by the community members, their diversity highlighting how individually people can interpret their connection to a """"place"""". Flowers, houses, maple leafs, cowboy boots and animals are just some of the elements which the community have defined as being significant to them, personally.","""Dynamic and fluid in the day, this installation glows at night shifting the focus from the symbols to elements representing waves. This acknowledges the significance of our rivers, one of the most defining elements of our city; both an original mode of transportation and a common link to connect the stories of our history and the stories of today.""","","https://www.calgary.ca/_layouts/cocis/DirectDownload.aspx?target=http%3a%2f%2fwww.calgary.ca%2fCSPS%2fRecreation%2fDocuments%2fPublic-art%2fPercent-for-Public-Art-MartindaleLRT.pdf&noredirect=1&sf=1","-113.96824272334","51.1176220333089","""(51.117622033309, -113.96824272334)""","4","9","180"
"P2012.003.001","Downtown","Ascension","INCIPIO MODO","Poetic Park ( Fourth Avenue and Ninth Street S.W.)","These two ascending creatures vary in scale and form depending upon the observer's viewpoint.","To the pedestrian they are larger than life, ascending and climbing throughout the landscape. To those in the neighbouring buildings, their form and motion define the space they inhabit.","""Fabricated locally, these sculptures were purposefully constructed to be modular in nature, consisting of three sections to be assembled like a tripod. This format allowed the composition of each of the insects to be determined by the terrain of the park, as the three sections were able to be adjusted and formed to respond to the site itself. Each creature is the same, yet has its own unique perspective.""","","https://www.calgary.ca/CSPS/Recreation/Documents/Public-art/Percent-for-Public-Art-Ascension.pdf","-114.083680855955","51.0496215542626","""(51.049621554263, -114.083680855955)""","1","14","45"
"P2012.005.001","Southeast","Calgary Hawk Hill Sentinels","Beverly Pepper","Ralph Klein Park (12350 84th St. S.E.)","From a distance, visitors to Ralph Klein Park will notice three monolithic sculptures rising above two pyramid-like mounds. This is Hawk Hill Calgary Sentinels.","Rising into the sky, it is impossible not to feel the presence of the sculptural landforms. The mounds physically define this place, drawing us to them by their sheer presence, making us aware of the vastness of this site. The core-ten steel sculptures seem to be timeless in age, their massive forms highlighting the significance of this wetland location to our city and our environment.","""""""The monoliths...are meant to herald the uniqueness of the wetlands...(and) offer a place for reflection and contemplative thought..."""" - Beverly Pepper""","","https://www.calgary.ca/CSPS/Recreation/Pages/Public-Art/Hawk-Hill-Calgary-Sentinels-Public-Artwork.aspx","-113.9014875928","50.9375868684979","""(50.937586868498, -113.9014875928)""","3","4","211"
"P2013.001.001","Northeast","Travelling Light","inges idee","96 Avenue N.E. (Near Airport Trail and Deerfoot Trail Interchange)","Simple in form, yet bold in appearance, this functional and sculptural public art installation soars 17 meters into the sky.","<i>Travelling Light is a site-specific sculpture that examines and brings to life the theme of movement.  Functioning as a street lamp, the structure serves to frame the landscape around it.  This large circular form makes reference to one of the oldest symbols of transportation in existence, the wheel.</i>","""Pedestrians, cyclists, vehicles, trains and planes all pass by this landmark, each engaging in their own specific mode of transportation. Motion and movement are referenced and united figuratively by a universal symbol, the circle.""","","https://www.calgary.ca/CSPS/Recreation/Pages/Public-Art/96-Avenue-NE.aspx","-114.041870675757","51.1424325773849","""(51.142432577385, -114.041870675757)""","4","11","163"
"P2013.002.001","Downtown","Luminous Crossings","Cliff Garten","City Hall LRT Station (Third St. S.E.)","This interactive public art installation consists of 20 components: two large-scale vertical sculptures, plus three hanging works, on four stations located at either end of the Seventh Avenue LRT line.","Referencing the idea of the living room or waiting area, there are four chandelier-like hanging sculptures in each canopy of the east and west gateway stations that give the waiting areas of the platforms a different quality. Additionally, their changing light show is a pleasant surrounding while waiting for the train.","","","https://www.calgary.ca/CSPS/Recreation/Pages/Public-Art/Downtown-Gateway-LRT-Stations.aspx","-114.056673544737","51.0462987504574","""(51.046298750457, -114.056673544737)""","3","7","262"
"P2013.002.001","Downtown","Luminous Crossings","Cliff Garten","Downtown West - Kerby LRT Station (10th St. S.W.)","This interactive public art installation consists of 20 components: two large-scale vertical sculptures, plus three hanging works, on four stations located at either end of the Seventh Avenue LRT line.","Referencing the idea of the living room or waiting area, there are four chandelier-like hanging sculptures in each canopy of the east and west gateway stations that give the waiting areas of the platforms a different quality. Additionally, their changing light show is a pleasant surrounding while waiting for the train.","","","https://www.calgary.ca/CSPS/Recreation/Pages/Public-Art/Downtown-Gateway-LRT-Stations.aspx","-114.087477731806","51.0471864950754","""(51.047186495075, -114.087477731806)""","1","14","45"
"P2013.002.001","Downtown","Luminous Crossings","Cliff Garten","Downtown West - Kerby LRT Station (10th St. S.W.)","This interactive public art installation consists of 20 components: two large-scale vertical sculptures, plus three hanging works, on four stations located at either end of the Seventh Avenue LRT line.","These illuminated sculptures are integrated with Calgary's LRT system to change colours when the train arrives, docks and leaves the station. The structures of the sculptures are developed from images of rail transportation, connecting the artwork directly to the purpose and use of this site.","","","https://www.calgary.ca/CSPS/Recreation/Pages/Public-Art/Downtown-Gateway-LRT-Stations.aspx","-114.086933384706","51.0471537021363","""(51.047153702136, -114.086933384706)""","1","14","45"
"P2013.002.001","Downtown","Luminous Crossings","Cliff Garten","City Hall LRT Station (Third Street. S.E.)","This interactive public art installation consists of 20 components: two large-scale vertical sculptures, plus three hanging works, on four stations located at either end of the Seventh Avenue LRT line.","These illuminated sculptures are integrated with Calgary's LRT system to change colours when the train arrives, docks and leaves the station. The structures of the sculptures are developed from images of rail transportation, connecting the artwork directly to the purpose and use of this site.","","","https://www.calgary.ca/CSPS/Recreation/Pages/Public-Art/Downtown-Gateway-LRT-Stations.aspx","-114.056421884395","51.0462915006327","""(51.046291500633, -114.056421884395)""","3","7","262"
"P2014.001.001","Southwest","Chinook Arc","Joe O'Connell and Blessing Hancock with Creative Machines (Technical Consultant)","Barb Scott Park (12th Ave. and Ninth St. S.W.)","This artwork is an interactive, illuminated sculpture that responds to human interaction.","Illuminated at night, visitors have complete control over the lighting of the sculpture through an optical sensor that projects the movements and colors it sees onto the artwork's surface. Wave your hands, move colored objects or play a movie from your cell phone and witness the unique light sequence that takes shape.","","","https://www.calgary.ca/CSPS/Recreation/Pages/Public-Art/Chinook-Arc-Public-Artwork.aspx","-114.083835239681","51.0419029214156","""(51.041902921416, -114.083835239681)""","1","14","260"
"P2014.002.001","Southwest","Charged Line","Jill Anholt","South Calgary Fire Station No. 5 (3129 14th St. S.W.)","That immediate moment when water is first released into a hose, charging it to life is represented in this multi-sculptural installation, Charged Line.","Fire station No. 5 is one of the longest functioning stations in the City of Calgary. This sculptural installation, which spans the site of the original fire station walls, makes direct reference to not only the history of this site, but also the activities the Fire Department employs for the safety of our city.","""The texture on the sculptures' columns references cloth hoses originally utilized by The Calgary Fire Department. The brass couplings located at the center and tops of the sculptures are reclaimed from retired City of Calgary fire hoses. In a manner similar to a cloth fire hose, the materials used purposefully change with age and will continue to alter in colour with exposure to the weather and time.""","","https://www.calgary.ca/CSPS/Recreation/Pages/Public-Art/Charged-Line-Public-Artwork.aspx","-114.095029559597","51.0258152485024","""(51.025815248502, -114.095029559597)""","1","14","207"
"P2014.004.001","Southwest","Under the Helmet","Ilan Sandler","Windsor Park Fire Station (5536 4 St. S.W.)","Under the Helmet is a large aluminum sculpture of a firefighter's helmet, constructed from the characteristics of retired City of Calgary Fire hoses.","While visually simple in form, the artwork speaks to the complex relationships and dependencies that exist among firefighters and their equipment; fusing the personal protection the helmet offers and the uniform it represents into a monument to the profession.","""During his research into the firefighting community, the artist was taken with the significance this piece of equipment holds to members of the Calgary Fire Department. The helmet distinguishes the individuality of the firefighter while symbolizing membership on a team, and represents the challenges and the rewards firefighters experience while under the helmet.""","","https://www.calgary.ca/CSPS/Recreation/Pages/Public-Art/Under-the-Helmet-Public-Artwork.aspx","-114.071361015798","51.0048143972593","""(51.004814397259, -114.071361015798)""","1","8","144"
"P2014.006.001","Northeast","Frozen River","Stephen Glassman","Emergency Operations Centre (673 First St. N.E.)","In suspended motion, like a Frozen River, this sculpture responds to Calgary's dramatic and varied landscape.","Beauty, force and nature. These elements inspired this grand sculpture, which pays tribute to the dramatic and ever-changing natural environment the Emergency Operations Centre is tasked with being responsive to.","","","https://www.calgary.ca/CSPS/Recreation/Pages/Public-Art/Frozen-River-Public-Artwork.aspx","-114.060746303514","51.0575827624613","""(51.057582762461, -114.060746303514)""","4","7","266"
"P2014.007.001","Southeast","Bow Passage Overlook","Lorna Jordan","Pearce Estate Park (1440 17A St. S.E.)","This engaging environmental artwork reframes how we look at the practice of public art and its ability to impact our physical and natural spaces.","By connecting the built environment with the natural, this artwork allows visitors to reframe how they engage with urban and natural spaces.  Utilizing native plant species along with locally sourced natural materials, the Overlook provides a unique opportunity to capture Calgary's natural beauty, while highlighting the dramatic land and waterscapes our city loves to enjoy.","","","https://www.calgary.ca/CSPS/Recreation/Pages/Public-Art/Bow-Passage-Overlook-Public-Art-Project.aspx","-114.014470677336","51.04319413508","""(51.04319413508, -114.014470677336)""","3","10","54"
"P2015.001.001","Northwest","Outflow","Brian Tolle Studio","Parkdale Plaza (along the Bow River at the end of 34A St. N.W.)","This inverted replica of Mount PeeChee, a mountain peak located north of Canmore along the Bow River, is the inspiration for this sculpture which merges form and function.","A memorial to the glacial origins of the Bow and its connection to shaping our community over the years, this functional sculpture allows the viewer to watch as our stormwater transitions from the urban environment back to the natural.","""With the sculpture acting as a handrail, the bridge deck and surrounding Plaza areas allow the public to take a moment to observe, reflect and consider the impact we have on our environment.""","","https://www.calgary.ca/CSPS/Recreation/Pages/Public-Art/Memorial-Drive-Landscape-of-Memory.aspx","-114.138616908994","51.0566033512638","""(51.056603351264, -114.138616908994)""","2","7","91"
"P2015.002.001","Northwest","roger that","Bill Pechet with Gabe Daly and Sara Zonousi of Pechet Studio","Tuscany LRT Station (Tuscany Springs Boulevard and Eamon Road N.W.)","This public art installation spans both sides of Tuscany LRT station, which is in the centre of two north west communities, Rocky Ridge and Tuscany.","This work explores the way movement, position, distance and time can all influence our perception of what we see.  A series of sculptural installations merge to form two, 12 meter high sculptures, composed of 440 amber coloured safety lights. As the viewer moves throughout the site the sculptures begin to shift and change form.","""From individual poles, seemingly placed in a disordered context, to a precise circle made up of fractional elements, this engaging work is meant to foster a cross-highway dialogue; as though neighbours were chatting over a fence.""","If you're there as the sun is descending, stop and watch the lights gradually and randomly emerge to further shift and change your perception of <i>roger that</i>.","https://www.calgary.ca/CSPS/Recreation/Pages/Public-Art/Tuscany-LRT-Public-Art.aspx","-114.234248074739","51.1345325568427","""(51.134532556843, -114.234248074739)""","2","3","252"
"P2015.014.001","Southeast","Forest Lawn Lift Station","Sans Façon","19th Avenue and 26th Street S.E.","An LED map of bar lights make up this unique to scale representation of the wastewater pipe system in the community of Forest Lawn. Connected to sensors that monitor the flow of wastewater in the pipes, the lights change colour based on flow levels.","Identified as a WATERSHED+ initiative, this project offered a unique opportunity to integrate art within the thinking and design of a new lift station. Lead artists Sans Façon focused on the process of revealing and connecting the importance of water in our daily lives at all stages of this project.","""Lift stations are used throughout the city to lift wastewater from low-lying areas to higher areas where it can flow, using the force of gravity, to one of Calgary's wastewater treatment plants.""","This installation is housed within the structure of such a facility, thereby allowing visitors to witness a small portion of the 4,500 kilometer wastewater system.","https://www.calgary.ca/CSPS/Recreation/Pages/Public-Art/Forest-Lawn-Lift-Station-Public-Artwork.aspx","-113.99623713161","51.0358009163165","""(51.035800916317, -113.99623713161)""","3","12","15"
"P2015.015.001","Southeast","Ripple","Sky Spirit","12 Street S.E. by 8 Avenue S.E.(parklet)","Inspired by a River Blessing and generated in consultation with the local Inglewood community and representatives from the Blackfoot and Cree Nations, this walking circle is designed to be a meaningful vantage point from which to consider the river.","Seven pathways coil towards a central meditative space which hosts four motifs to represent the stages of life and compass points.","""Birth (east) is represented by the eagle, an otter (south) signifies youth, middle age (west) is characterized by a beaver and the buffalo (north) embodies wisdom age.""","The seven paths also represent the seven teachings of humility, respect, truth, courage, honesty, love and wisdom. There is a subtle break added to the walking circle, allowing a mythical river to symbolically flow through the circle. ","https://www.calgary.ca/CSPS/Recreation/Pages/Public-Art/Ripple-Public-Artwork.aspx","-114.031442705824","51.0420712754452","""(51.042071275445, -114.031442705824)""","3","10","54"
"P2015.016.001","Northwest","Collected Stories: A Tribute to Georgina Thomson Library","Kari Woo","Georgina Thomson Offices Exterior (772 Northmount Dr. N.W.)","The public artwork for the latest incarnation of this historic building aims to honour the legacy of this former library and the late `answer lady' Georgina Thomson who worked here for many years.","Kari Woo developed her public art project to purposefully bridge the former use of the site with its new purpose as a neighbourhood services office.","""Working alongside the local community and the family and friends of the late Georgina Thomson, she encouraged the exploration of the piece and its use in the new context to develop two installations that celebrate the site's past and present.""","Outside the facility, Thomson's position as a librarian at this former library building is captured through a mini-library which invites visitors to take or leave a book. Beside this is a bench, engraved with the favourite quotes of community members, encouraging visitors to stop, gather and explore.","https://www.calgary.ca/CSPS/Recreation/Pages/Public-Art/Georgina-Thomson-Offices-Public-Art-Project.aspx","-114.094975353798","51.0836016688357","""(51.083601668836, -114.094975353798)""","2","7","214"
"P2015.016.002","Northwest","An Exchange of Words: A Community Book Exchange","Kari Woo","Georgina Thomson Offices Interior (772 Northmount Dr. N.W.)","The public artwork for the latest incarnation of this historic building aims to honour the legacy of this former library and the late `answer lady' Georgina Thomson who worked here for many years.","Kari Woo developed her public art project to purposefully bridge the former use of the site with its new purpose as a neighbourhood services office.","""Working alongside the local community and the family and friends of the late Georgina Thomson, she encouraged the exploration of the piece and its use in the new context to develop two installations that celebrate the site's past and present.""","The interior installation features a collection of collages, inspired by items collected during a workshop, which invited Calgarians to tell the story of the building and the woman it was named after.","https://www.calgary.ca/CSPS/Recreation/Pages/Public-Art/Georgina-Thomson-Offices-Public-Art-Project.aspx","-114.095110058153","51.0836259123615","""(51.083625912362, -114.095110058153)""","2","7","214"
"UB1","Temporary Works","Utility Box","Joanna Jensen","Sarcee Trail N.W. at 112 Ave N.W. (S.W. corner)","","The Utility Box Program started in 2010 as a pilot project initiated by The City of Calgary Roads. Initially conceived as a highly successful graffiti abatement measure, widespread popularity enabled the program to grow and become permanent in 2011.","","","https://www.calgary.ca/CSPS/Recreation/Pages/Public-Art/Utility-Box-Public-Art-Program.aspx","-114.162841841465","51.1596968032138","""(51.159696803214, -114.162841841465)""","2","3","202"
"UB10","Temporary Works","Utility Box","Bram Timmer","Country Hills Blvd. N.W. and Country Hills Drive N.W. (N.E. corner)","","The Utility Box Program started in 2010 as a pilot project initiated by The City of Calgary Roads. Initially conceived as a highly successful graffiti abatement measure, widespread popularity enabled the program to grow and become permanent in 2011.","","","https://www.calgary.ca/CSPS/Recreation/Pages/Public-Art/Utility-Box-Artist-Roster-Bram-Timmer.aspx","-114.068677294696","51.1514831618242","""(51.151483161824, -114.068677294696)""","2","2","172"
"UB11","Temporary Works","Utility Box","Jason Scott Johnson and Nicola Yssel Johnson","Country Hills Blvd. N.W. and Country Hills Drive N.W.  (S.E. corner)","","The Utility Box Program started in 2010 as a pilot project initiated by The City of Calgary Roads. Initially conceived as a highly successful graffiti abatement measure, widespread popularity enabled the program to grow and become permanent in 2011.","","","https://www.calgary.ca/CSPS/Recreation/Pages/Public-Art/Utility-Box-Artist-Roster-Jason-Scott-Johnson-and-Nicola-Yssel-Johnson.aspx","-114.076982606787","51.147449873825","""(51.147449873825, -114.076982606787)""","2","2","172"
"UB12","Temporary Works","Utility Box","Jason Scott Johnson and Nicola Yssel Johnson","Country Hills Blvd. N.W. and Country Hills Square N.W. (S.W. corner)","","The Utility Box Program started in 2010 as a pilot project initiated by The City of Calgary Roads. Initially conceived as a highly successful graffiti abatement measure, widespread popularity enabled the program to grow and become permanent in 2011.","","","https://www.calgary.ca/CSPS/Recreation/Pages/Public-Art/Utility-Box-Artist-Roster-Jason-Scott-Johnson-and-Nicola-Yssel-Johnson.aspx","-114.073658661194","51.1482649603556","""(51.148264960356, -114.073658661194)""","2","2","172"
